{
  "schema_version": "0.1.0",
  "checkpoint_id": "cp_00000000-0000-4000-8000-000000000001",
  "run_id": "run_00000000-0000-4000-8000-000000000001",
  "created_at": "2026-09-06T02:00:00.500Z",
  "last_event_id": "evt_00000000-0000-4000-8000-000000000002",
  "sequence": 2,
  "state_hash": "0000000000000000000000000000000000000000000000000000000000000000",
  "state": {
    "answer": "ok"
  }
}
